{"authorized_go":false,"body_reads":"0","evidence_digest":"8706a5c09d7c585060e0bc75b579573202c31bff7cafed7c548897ed1c4cefe5","evidence_version":"second-brain-me-wiki-source-evidence-v1","fixture_digest":"75078444c9ab73896c862302da956cabe2b987f4d1d7e5011d2de1fa2e8306d6","import_invoked":false,"profile_digest":"ffd64b734704423bc967afdc9e358cc2c4af4ad05b7ac8c9c4b7e551ef499777","serving_promotion":false,"source_mutation":false,"state":"CONTRACT_AND_SYNTHETIC_FIXTURE_ONLY"}
